row_number,title,detail_url,resource_id,contracting_authority,info,date_published,submission_deadline,procedure,status,notice_pdf_url,award_date,estimated_value,cycle
1693,Dublin FIre Brigade - Single Party Framework for the Supply of Dress Uniform to Dublin Fire Brigade Personnel,https://www.etenders.gov.ie/epps/cft/prepareViewCfTWS.do?resourceId=2816947,2816947,Dublin City Council,,Fri Feb 09 08:11:45 GMT 2024,Mon Mar 11 12:00:00 GMT 2024,Open,Established,https://www.etenders.gov.ie/epps/cft/downloadNoticeForAdvSearch.do?resourceId=2816947,,300000.0,1
1694,"UCDOPP5392 Multi-Supplier Framework Agreement for Concessions to provide Café, Hospitality and Restaurant Services to University College Dublin",https://www.etenders.gov.ie/epps/cft/prepareViewCfTWS.do?resourceId=2914595,2914595,University College Dublin ( UCD ),,Fri Feb 09 08:11:17 GMT 2024,Wed Apr 10 12:00:00 IST 2024,Open,Established,https://www.etenders.gov.ie/epps/cft/downloadNoticeForAdvSearch.do?resourceId=2914595,,7.57E7,1
1695,Supply of Medical and Surgical Consumables,https://www.etenders.gov.ie/epps/dps/prepareViewCfTDPSWS.do?resourceId=1772631,1772631,The National Maternity Hospital_233,,Thu Feb 08 14:55:43 GMT 2024,,Dynamic Purchasing System,Established,,Mon May 01 00:00:00 IST 2023,0.0,1
1696,SINGLE PARTY FRAMEWORK FOR THE PROVISION OF MUSIC PR SERVICES TO HRI RACECOURSES,https://www.etenders.gov.ie/epps/cft/prepareViewCfTWS.do?resourceId=3063468,3063468,Horse Racing Ireland (HRI),,Thu Feb 08 11:56:26 GMT 2024,Thu Feb 29 12:00:00 GMT 2024,Open,Established,https://www.etenders.gov.ie/epps/cft/downloadNoticeForAdvSearch.do?resourceId=3063468,,200000.0,1
1697,Establishment of a Framework for the Supply of Hydrotreated Vegetable Oil (HVO) to Mayo County Council,https://www.etenders.gov.ie/epps/cft/prepareViewCfTWS.do?resourceId=3053381,3053381,Mayo County Council_1127,,Thu Feb 08 09:03:30 GMT 2024,Fri Mar 01 17:00:00 GMT 2024,Open,Established,https://www.etenders.gov.ie/epps/cft/downloadNoticeForAdvSearch.do?resourceId=3053381,,,1
1698,BS-TEN-012024 Supply of window Blinds,https://www.etenders.gov.ie/epps/cft/prepareViewCfTWS.do?resourceId=3029296,3029296,Irish Defence Forces_1144,,Wed Feb 07 08:10:11 GMT 2024,Tue Mar 12 12:00:00 GMT 2024,Open,Established,https://www.etenders.gov.ie/epps/cft/downloadNoticeForAdvSearch.do?resourceId=3029296,,290000.0,1
1699,18/044 - Specialised Construction Services,https://www.etenders.gov.ie/epps/dps/prepareViewCfTDPSWS.do?resourceId=1741499,1741499,Gas Networks Ireland,,Tue Feb 06 10:54:27 GMT 2024,,Dynamic Purchasing System,Established,,Mon May 01 00:00:00 IST 2023,0.0,1
1700,PR Agency Services US West Coast,https://www.etenders.gov.ie/epps/cft/prepareViewCfTWS.do?resourceId=3027378,3027378,IDA Ireland,,Sun Feb 04 12:04:48 GMT 2024,Mon Mar 04 12:00:00 GMT 2024,Open,Established,https://www.etenders.gov.ie/epps/cft/downloadNoticeForAdvSearch.do?resourceId=3027378,,900000.0,1
1701,"Framework for Pavement and Associated Minor Works on National, Regional, and Local Roads",https://www.etenders.gov.ie/epps/cft/prepareViewCfTWS.do?resourceId=3040159,3040159,Roscommon County Council_424,,Sun Feb 04 10:36:47 GMT 2024,Fri Mar 15 16:00:00 GMT 2024,Open,Established,https://www.etenders.gov.ie/epps/cft/downloadNoticeForAdvSearch.do?resourceId=3040159,,3000000.0,1
1702,8044-1 QS Building Survey Inspections,https://www.etenders.gov.ie/epps/dps/prepareViewCfTDPSWS.do?resourceId=3039928,3039928,Iarnród Eireann-Irish Rail,,Fri Feb 02 09:57:02 GMT 2024,,Dynamic Purchasing System,Established,,,1000000.0,1
1703,8044 - Building Survey Inspections,https://www.etenders.gov.ie/epps/dps/prepareViewCfTDPSWS.do?resourceId=3036412,3036412,Iarnród Eireann-Irish Rail,,Fri Feb 02 09:27:05 GMT 2024,,Dynamic Purchasing System,Established,https://www.etenders.gov.ie/epps/cft/downloadNoticeForAdvSearch.do?resourceId=3036412,,1000000.0,1
1704,Implementation and Provision of Smart Demand Responsive Transport (SDRT) Solution and Services,https://www.etenders.gov.ie/epps/cft/prepareViewCfTWS.do?resourceId=3026521,3026521,National Transport Authority_1149,,Fri Feb 02 08:12:14 GMT 2024,Fri Apr 12 12:00:00 IST 2024,Open,Established,https://www.etenders.gov.ie/epps/cft/downloadNoticeForAdvSearch.do?resourceId=3026521,,1.5E7,1
1705,NTUTORR ATU Single Operator Framework Agreement Virtual Production LED System,https://www.etenders.gov.ie/epps/cft/prepareViewCfTWS.do?resourceId=2982954,2982954,Atlantic Technological University,,Thu Feb 01 23:32:43 GMT 2024,Mon Mar 04 12:00:00 GMT 2024,Open,Established,https://www.etenders.gov.ie/epps/cft/downloadNoticeForAdvSearch.do?resourceId=2982954,,,1
1706,"HSE 22608 DPS for Medical Grade PCs, Clinical Workstations on Wheels (WOWs), ePMA Dispensing Carts and Phlebotomy Carts",https://www.etenders.gov.ie/epps/dps/prepareViewCfTDPSWS.do?resourceId=3023546,3023546,Health Service Executive (HSE),,Thu Feb 01 08:11:51 GMT 2024,,Dynamic Purchasing System,Established,https://www.etenders.gov.ie/epps/cft/downloadNoticeForAdvSearch.do?resourceId=3023546,,1.0,1
1707,KCETB invite submissions for the provision of Periodic Inspection and Testing of Electrical Installations and Portable Appliance Testing (PAT)for Kilkenny and Carlow Education and Training Board,https://www.etenders.gov.ie/epps/cft/prepareViewCfTWS.do?resourceId=3016007,3016007,Kilkenny and Carlow ETB,,Thu Feb 01 08:10:53 GMT 2024,Fri Mar 01 12:00:00 GMT 2024,Open,Established,https://www.etenders.gov.ie/epps/cft/downloadNoticeForAdvSearch.do?resourceId=3016007,,400000.0,1
1708,"Single Party Framework Agreement for Racecard Design, Print and Delivery to Horse Racing Ireland and HRI Racecourses",https://www.etenders.gov.ie/epps/cft/prepareViewCfTWS.do?resourceId=3006476,3006476,Horse Racing Ireland (HRI),,Wed Jan 31 08:11:00 GMT 2024,Tue Mar 05 00:00:00 GMT 2024,Open,Established,https://www.etenders.gov.ie/epps/cft/downloadNoticeForAdvSearch.do?resourceId=3006476,,,1
1709,Tender for the Supply of Electric Vehicles,https://www.etenders.gov.ie/epps/cft/prepareViewCfTWS.do?resourceId=3017120,3017120,Oberstown Children Detention Campus,,Wed Jan 31 08:10:53 GMT 2024,Thu Feb 29 12:00:00 GMT 2024,Open,Established,https://www.etenders.gov.ie/epps/cft/downloadNoticeForAdvSearch.do?resourceId=3017120,,400000.0,1
1710,Supply and Delivery of Engineering Class Materials in Tipperary Education and Training Board,https://www.etenders.gov.ie/epps/cft/prepareViewCfTWS.do?resourceId=2953301,2953301,Tipperary Education and Training Board_1284,,Tue Jan 30 13:52:32 GMT 2024,Thu Feb 29 12:00:00 GMT 2024,Open,Established,https://www.etenders.gov.ie/epps/cft/downloadNoticeForAdvSearch.do?resourceId=2953301,,290000.0,1
1711,23/049 - Cyber Security Services,https://www.etenders.gov.ie/epps/dps/prepareViewCfTDPSWS.do?resourceId=3009835,3009835,Gas Networks Ireland,,Tue Jan 30 13:52:09 GMT 2024,,Dynamic Purchasing System,Established,https://www.etenders.gov.ie/epps/cft/downloadNoticeForAdvSearch.do?resourceId=3009835,,,1
1712,Single Supplier Framework Agreement for a Creative Advertising Agency,https://www.etenders.gov.ie/epps/cft/prepareViewCfTWS.do?resourceId=3017444,3017444,Clare County Council,,Mon Jan 29 16:52:43 GMT 2024,Tue Mar 05 14:00:00 GMT 2024,Open,Established,https://www.etenders.gov.ie/epps/cft/downloadNoticeForAdvSearch.do?resourceId=3017444,,180000.0,1
1713,Specialised cleaning services for the National Gallery of Ireland,https://www.etenders.gov.ie/epps/cft/prepareViewCfTWS.do?resourceId=3012570,3012570,National Gallery of Ireland,,Mon Jan 29 10:42:15 GMT 2024,Fri Mar 01 14:00:00 GMT 2024,Open,Established,https://www.etenders.gov.ie/epps/cft/downloadNoticeForAdvSearch.do?resourceId=3012570,,200000.0,1
1714,"MCC Integrated Design Team Framework and IDT for 4 no. Projects in Ballinrobe, Mayo",https://www.etenders.gov.ie/epps/cft/prepareViewCfTWS.do?resourceId=3006775,3006775,Mayo County Council_1127,,Sun Jan 28 13:03:24 GMT 2024,Wed Mar 06 16:00:00 GMT 2024,Open,Established,https://www.etenders.gov.ie/epps/cft/downloadNoticeForAdvSearch.do?resourceId=3006775,,500000.0,1
1715,Dublin City Council PANEL of Training Providers in 2 Lots - Title III Services,https://www.etenders.gov.ie/epps/dps/prepareViewCfTDPSWS.do?resourceId=2990912,2990912,Dublin City Council,,Fri Jan 26 08:12:03 GMT 2024,,Dynamic Purchasing System,Established,https://www.etenders.gov.ie/epps/cft/downloadNoticeForAdvSearch.do?resourceId=2990912,,6000000.0,1
1716,Single Party Framework Agreement for Supply of Wood Pellets and Maintenance of Biomass Boiler (GALW/BUILD1623/2023),https://www.etenders.gov.ie/epps/cft/prepareViewCfTWS.do?resourceId=2998705,2998705,University of Galway (ID 1400),,Fri Jan 26 08:11:49 GMT 2024,Mon Feb 26 12:00:00 GMT 2024,Open,Established,https://www.etenders.gov.ie/epps/cft/downloadNoticeForAdvSearch.do?resourceId=2998705,,200000.0,1
1717,Request for Tender for provision of a Single Party Framework for Managed IT and Associated Services,https://www.etenders.gov.ie/epps/cft/prepareViewCfTWS.do?resourceId=2994033,2994033,Sport Ireland,,Fri Jan 26 08:10:42 GMT 2024,Mon Feb 26 12:00:00 GMT 2024,Open,Established,https://www.etenders.gov.ie/epps/cft/downloadNoticeForAdvSearch.do?resourceId=2994033,,600000.0,1
1718,"RFT for the Establishment of a Single Party Framework Agreement for the Provision of UX, Digital Design and Related Services",https://www.etenders.gov.ie/epps/cft/prepareViewCfTWS.do?resourceId=2989157,2989157,Houses of the Oireachtas Service,,Thu Jan 25 08:10:49 GMT 2024,Thu Feb 29 12:00:00 GMT 2024,Open,Established,https://www.etenders.gov.ie/epps/cft/downloadNoticeForAdvSearch.do?resourceId=2989157,,400000.0,1
1719,"Manage, Implementation and Installation of a Pobal HR System and associated services 0274",https://www.etenders.gov.ie/epps/cft/prepareViewCfTWS.do?resourceId=2980170,2980170,Pobal,,Wed Jan 24 08:11:20 GMT 2024,Thu Feb 29 14:00:00 GMT 2024,Open,Established,https://www.etenders.gov.ie/epps/cft/downloadNoticeForAdvSearch.do?resourceId=2980170,,3500000.0,1
1720,Request-for-Tenders for the establishment of a Single Supplier Framework for the Supply of Creative Digital Content Production Services for Technological University Dublin. (TU Dublin),https://www.etenders.gov.ie/epps/cft/prepareViewCfTWS.do?resourceId=2983324,2983324,Technological University Dublin (TU Dublin),,Wed Jan 24 08:11:10 GMT 2024,Fri Feb 23 14:00:00 GMT 2024,Open,Established,https://www.etenders.gov.ie/epps/cft/downloadNoticeForAdvSearch.do?resourceId=2983324,,600000.0,1
1721,Digital Collections Access Solution for University of Galway - Single Party Framework (GALW/JHL1664/2023),https://www.etenders.gov.ie/epps/cft/prepareViewCfTWS.do?resourceId=2983033,2983033,University of Galway (ID 1400),,Wed Jan 24 08:11:10 GMT 2024,Mon Feb 26 16:00:00 GMT 2024,Open,Established,https://www.etenders.gov.ie/epps/cft/downloadNoticeForAdvSearch.do?resourceId=2983033,,500000.0,1
1722,": MULTI SUPPLIER FRAMEWORK FOR THE SUPPLY AND DELIVERY OF DOCUMENTATION WRITER, EDITOR SERVICES TO THE University of Limerick",https://www.etenders.gov.ie/epps/cft/prepareViewCfTWS.do?resourceId=2981972,2981972,University of Limerick_1124,,Wed Jan 24 08:10:44 GMT 2024,Tue Jan 23 14:00:00 GMT 2024,Open,Established,https://www.etenders.gov.ie/epps/cft/downloadNoticeForAdvSearch.do?resourceId=2981972,,350000.0,1
1723,LA2713F - RFT - DAFM - Multi Supplier Framework for the Supply of ISO 17034 Accredited Analytical Standards.,https://www.etenders.gov.ie/epps/cft/prepareViewCfTWS.do?resourceId=2963397,2963397,Education Procurement Service (EPS),,Wed Jan 24 08:10:31 GMT 2024,Wed Feb 28 12:00:00 GMT 2024,Open,Established,https://www.etenders.gov.ie/epps/cft/downloadNoticeForAdvSearch.do?resourceId=2963397,,,1
1724,RFT 03/24DL Single Party Framework Agreement for the Maintenance of Building Management System (BMS) at Atlantic Technological University,https://www.etenders.gov.ie/epps/cft/prepareViewCfTWS.do?resourceId=2964840,2964840,Atlantic Technological University,,Sat Jan 20 15:05:50 GMT 2024,Tue Feb 20 12:00:00 GMT 2024,Open,Established,https://www.etenders.gov.ie/epps/cft/downloadNoticeForAdvSearch.do?resourceId=2964840,,,1
1725,THR073F: Employee Assistance Services to the Public Sector,https://www.etenders.gov.ie/epps/cft/prepareViewCfTWS.do?resourceId=2959234,2959234,The Office of Government Procurement,,Fri Jan 19 08:12:30 GMT 2024,Tue Feb 06 13:00:00 GMT 2024,Accelerated open,Established,https://www.etenders.gov.ie/epps/cft/downloadNoticeForAdvSearch.do?resourceId=2959234,,,1
1726,NTUTORR Single Operator Framework Agreement Digital Discovery Tool for Learners to Assess Digital Capabilities,https://www.etenders.gov.ie/epps/cft/prepareViewCfTWS.do?resourceId=2947312,2947312,Atlantic Technological University,,Thu Jan 18 23:47:57 GMT 2024,Mon Feb 19 12:00:00 GMT 2024,Open,Established,https://www.etenders.gov.ie/epps/cft/downloadNoticeForAdvSearch.do?resourceId=2947312,,,1
1727,Multi-Party Framework Agreement for the provision of professional services to support the EPA in its role as secretariat to the National Dialogue on Climate Action.,https://www.etenders.gov.ie/epps/cft/prepareViewCfTWS.do?resourceId=2955464,2955464,Environmental Protection Agency,,Thu Jan 18 17:33:57 GMT 2024,Mon Feb 19 17:00:00 GMT 2024,Open,Established,https://www.etenders.gov.ie/epps/cft/downloadNoticeForAdvSearch.do?resourceId=2955464,,230000.0,1
1728,Establishment of a Single-Operator Framework Agreement for the supply (and if required installation) of Safety Cabinets to University College Cork.,https://www.etenders.gov.ie/epps/cft/prepareViewCfTWS.do?resourceId=2963159,2963159,University College Cork,,Thu Jan 18 10:40:58 GMT 2024,Wed Feb 14 12:00:00 GMT 2024,Open,Established,https://www.etenders.gov.ie/epps/cft/downloadNoticeForAdvSearch.do?resourceId=2963159,,200000.0,1
1729,DYNAMIC PURCHASING SYSTEM (DPS) FOR PROFESSIONAL DEVELOPMENT AND CORPORATE TRAINING PROVIDERS,https://www.etenders.gov.ie/epps/dps/prepareViewCfTDPSWS.do?resourceId=2962136,2962136,Tourism Ireland CLG,,Wed Jan 17 17:41:10 GMT 2024,,Dynamic Purchasing System,Established,,,1200000.0,1
1730,Provision of Loose Furniture to the Technological University of the Shannon,https://www.etenders.gov.ie/epps/cft/prepareViewCfTWS.do?resourceId=2916655,2916655,Technological University of the Shannon: Midlands Midwest (TUSMM),,Wed Jan 17 14:33:21 GMT 2024,Fri Feb 16 13:00:00 GMT 2024,Open,Established,https://www.etenders.gov.ie/epps/cft/downloadNoticeForAdvSearch.do?resourceId=2916655,,1000000.0,1
1731,CIE 7289  - QUALIFICATION SYSTEM FOR PROVISION OF PENETRATION TESTING,https://www.etenders.gov.ie/epps/dps/prepareViewCfTDPSWS.do?resourceId=1749698,1749698,Iarnród Eireann-Irish Rail,,Tue Jan 16 15:22:20 GMT 2024,,Dynamic Purchasing System,Established,,Mon May 01 00:00:00 IST 2023,0.0,1
1732,The provision of Small Construction Maintenance Related Services (internal and external) for WWETB Training Centre locations.,https://www.etenders.gov.ie/epps/cft/prepareViewCfTWS.do?resourceId=2946759,2946759,Waterford and Wexford Education and Training Board_110494,,Mon Jan 15 16:55:31 GMT 2024,Fri Feb 23 13:00:00 GMT 2024,Open,Established,https://www.etenders.gov.ie/epps/cft/downloadNoticeForAdvSearch.do?resourceId=2946759,,800000.0,1
1733,18/212 - Linepipe Qualification System Questionnaire,https://www.etenders.gov.ie/epps/dps/prepareViewCfTDPSWS.do?resourceId=1742517,1742517,Gas Networks Ireland,,Mon Jan 15 14:52:58 GMT 2024,,Dynamic Purchasing System,Established,,Mon May 01 00:00:00 IST 2023,0.0,1
1734,Supply of Shellfish Fisheries and Survey Sampling Services,https://www.etenders.gov.ie/epps/cft/prepareViewCfTWS.do?resourceId=2945474,2945474,Marine Institute_1141,,Mon Jan 15 10:59:35 GMT 2024,Tue Feb 06 10:00:00 GMT 2024,Open,Established,https://www.etenders.gov.ie/epps/cft/downloadNoticeForAdvSearch.do?resourceId=2945474,,220000.0,1
1735,Provision of Information Security Resources to the Central Bank of Ireland,https://www.etenders.gov.ie/epps/cft/prepareViewCfTWS.do?resourceId=2926554,2926554,Central Bank of Ireland,,Sun Jan 14 12:27:57 GMT 2024,Fri Feb 23 12:00:00 GMT 2024,Open,Established,https://www.etenders.gov.ie/epps/cft/downloadNoticeForAdvSearch.do?resourceId=2926554,,6600000.0,1
1736,LA2698F - RFT for a Multi Supplier Framework for the Supply of Electronic Components and Consumables,https://www.etenders.gov.ie/epps/cft/prepareViewCfTWS.do?resourceId=2928857,2928857,Education Procurement Service (EPS),,Sun Jan 14 10:44:15 GMT 2024,Tue Feb 13 12:00:00 GMT 2024,Open,Established,https://www.etenders.gov.ie/epps/cft/downloadNoticeForAdvSearch.do?resourceId=2928857,,1.2E7,1
1737,Establishment of a Multi Party Framework Agreement for the provision of climate adaptation technical support services to the EPA.,https://www.etenders.gov.ie/epps/cft/prepareViewCfTWS.do?resourceId=2932934,2932934,Environmental Protection Agency,,Sat Jan 13 17:03:37 GMT 2024,Mon Feb 12 17:00:00 GMT 2024,Open,Established,https://www.etenders.gov.ie/epps/cft/downloadNoticeForAdvSearch.do?resourceId=2932934,,230000.0,1
1738,SINGLE PARTY FRAMEWORK FOR THE PROVISON OF CASH IN TRANSIT SERVICES TO HORSE RACING IRELAND AND SUBSIDIARIES,https://www.etenders.gov.ie/epps/cft/prepareViewCfTWS.do?resourceId=2933147,2933147,Horse Racing Ireland (HRI),,Sat Jan 13 16:42:44 GMT 2024,Thu Feb 15 12:00:00 GMT 2024,Open,Established,https://www.etenders.gov.ie/epps/cft/downloadNoticeForAdvSearch.do?resourceId=2933147,,2000000.0,1
1739,"Single Party FWA for the provision of Inspection, Servicing and Maintenance of CCTV, Access Control, Intruder Alarm Systems, Audio Visual Intercoms and Disabled Refuge Call System for TU Dublin",https://www.etenders.gov.ie/epps/cft/prepareViewCfTWS.do?resourceId=2929874,2929874,Technological University Dublin (TU Dublin),,Sat Jan 13 14:37:19 GMT 2024,Fri Feb 16 14:00:00 GMT 2024,Open,Established,https://www.etenders.gov.ie/epps/cft/downloadNoticeForAdvSearch.do?resourceId=2929874,,,1
1740,Request for Tenders for the provision of Multi-Party Framework for Public Relations and Media Relations Consultancy and Associated Services,https://www.etenders.gov.ie/epps/cft/prepareViewCfTWS.do?resourceId=2926277,2926277,Sport Ireland,,Fri Jan 12 21:16:20 GMT 2024,Tue Feb 13 12:00:00 GMT 2024,Open,Established,https://www.etenders.gov.ie/epps/cft/downloadNoticeForAdvSearch.do?resourceId=2926277,,300000.0,1
1741,"Single Party Framework Agreement for development, maintenance, upgrades, consultancy and technical support for PEMAC Care, i-Meeting and PEMAC Assets (GALW/BUILD1645/2023)",https://www.etenders.gov.ie/epps/cft/prepareViewCfTWS.do?resourceId=2902622,2902622,University of Galway (ID 1400),,Fri Jan 12 14:12:21 GMT 2024,Mon Feb 19 12:00:00 GMT 2024,Open,Established,https://www.etenders.gov.ie/epps/cft/downloadNoticeForAdvSearch.do?resourceId=2902622,,850000.0,1
1742,Dublin City Council - PANEL for the Provision of Hazardous Materials Surveys,https://www.etenders.gov.ie/epps/dps/prepareViewCfTDPSWS.do?resourceId=2932240,2932240,Dublin City Council,,Thu Jan 11 15:15:08 GMT 2024,,Dynamic Purchasing System,Established,,,215000.0,1
1743,RFT 02/24DL Mechanical Services Term Maintenance and Refurbishment (TMRC) at Atlantic Technological University Donegal,https://www.etenders.gov.ie/epps/cft/prepareViewCfTWS.do?resourceId=2930807,2930807,Atlantic Technological University,,Thu Jan 11 14:07:53 GMT 2024,Mon Feb 12 12:00:00 GMT 2024,Open,Established,https://www.etenders.gov.ie/epps/cft/downloadNoticeForAdvSearch.do?resourceId=2930807,,,1
1744,RFT 01/24DL Electrical Services Term Maintenance and Refurbishment (TMRC) at Atlantic Technological University Donegal,https://www.etenders.gov.ie/epps/cft/prepareViewCfTWS.do?resourceId=2930461,2930461,Atlantic Technological University,,Thu Jan 11 12:58:08 GMT 2024,Mon Feb 12 12:00:00 GMT 2024,Open,Established,https://www.etenders.gov.ie/epps/cft/downloadNoticeForAdvSearch.do?resourceId=2930461,,,1
1745,TERMINATED - Dublin City Council Panel for the Provision of Hazardous Materials Surveys,https://www.etenders.gov.ie/epps/dps/prepareViewCfTDPSWS.do?resourceId=2905774,2905774,Dublin City Council,,Wed Jan 10 12:26:58 GMT 2024,,Dynamic Purchasing System,Established,,,215000.0,1
1746,7826 - Qualification System for Softwood Timber Beams,https://www.etenders.gov.ie/epps/dps/prepareViewCfTDPSWS.do?resourceId=2924622,2924622,Iarnród Eireann-Irish Rail,,Wed Jan 10 12:23:34 GMT 2024,,Dynamic Purchasing System,Established,,,,1
1747,Multi Supplier Framework for the Provision of Painting Services to TUS Midwest,https://www.etenders.gov.ie/epps/cft/prepareViewCfTWS.do?resourceId=2875182,2875182,Technological University of the Shannon: Midlands Midwest (TUSMM),,Thu Jan 04 15:36:14 GMT 2024,Fri Feb 16 12:00:00 GMT 2024,Open,Established,https://www.etenders.gov.ie/epps/cft/downloadNoticeForAdvSearch.do?resourceId=2875182,,600000.0,1
1748,"Multi Supplier Framework Agreement for the Provision of Specialised Economic, Financial and Related Expert Consultancy Services",https://www.etenders.gov.ie/epps/cft/prepareViewCfTWS.do?resourceId=2891959,2891959,Commission for Regulation of Utilities,,Sun Dec 24 13:23:38 GMT 2023,Fri Feb 02 12:00:00 GMT 2024,Open,Established,https://www.etenders.gov.ie/epps/cft/downloadNoticeForAdvSearch.do?resourceId=2891959,,4.0E7,1
1749,Establishment of a Single Operator Framework Agreement for an Electronic Trial Master File (eTMF) and Associated Services (GALW/CON1646/2023),https://www.etenders.gov.ie/epps/cft/prepareViewCfTWS.do?resourceId=2889832,2889832,University of Galway (ID 1400),,Sat Dec 23 14:50:32 GMT 2023,Thu Feb 01 16:00:00 GMT 2024,Open,Established,https://www.etenders.gov.ie/epps/cft/downloadNoticeForAdvSearch.do?resourceId=2889832,,800000.0,1
1750,Galway City Council - Establishment of Multi Party Framework for Bid/Grant application writing services in Galway City Council,https://www.etenders.gov.ie/epps/cft/prepareViewCfTWS.do?resourceId=2882654,2882654,Galway City Council,,Fri Dec 22 08:10:52 GMT 2023,Mon Jan 22 12:00:00 GMT 2024,Open,Established,https://www.etenders.gov.ie/epps/cft/downloadNoticeForAdvSearch.do?resourceId=2882654,,,1
1751,"2023/66 CFT to establish a multi party FWA for the supply of Plumbing, Pipefitting, and Steel Consumables in 3 Lots",https://www.etenders.gov.ie/epps/cft/prepareViewCfTWS.do?resourceId=2880908,2880908,Louth and Meath Education and Training Board 1384,,Fri Dec 22 08:10:49 GMT 2023,Mon Feb 05 12:00:00 GMT 2024,Open,Established,https://www.etenders.gov.ie/epps/cft/downloadNoticeForAdvSearch.do?resourceId=2880908,,2500000.0,1
1752,Provision of Compliance Management Information System (CMIS) Solution,https://www.etenders.gov.ie/epps/dps/prepareViewCfTDPSWS.do?resourceId=2879665,2879665,Health Service Executive (HSE),,Thu Dec 21 08:12:30 GMT 2023,,Dynamic Purchasing System,Established,https://www.etenders.gov.ie/epps/cft/downloadNoticeForAdvSearch.do?resourceId=2879665,,0.0,1
1753,Dynamic Purchasing System (DPS) for the provision of Surveying Services to the OPW and Local Authorities,https://www.etenders.gov.ie/epps/dps/prepareViewCfTDPSWS.do?resourceId=2873309,2873309,Office of Public Works (OPW),,Thu Dec 21 08:12:13 GMT 2023,,Dynamic Purchasing System,Established,https://www.etenders.gov.ie/epps/cft/downloadNoticeForAdvSearch.do?resourceId=2873309,,5000000.0,1
1754,Tender for Event Related Health and Safety Services,https://www.etenders.gov.ie/epps/cft/prepareViewCfTWS.do?resourceId=2870299,2870299,Office of Public Works (OPW),,Thu Dec 21 08:11:14 GMT 2023,Tue Jan 30 12:00:00 GMT 2024,Open,Established,https://www.etenders.gov.ie/epps/cft/downloadNoticeForAdvSearch.do?resourceId=2870299,,3000000.0,1
1755,Single Supplier Framework for the Provision of Groundsman Services to MTU Cork,https://www.etenders.gov.ie/epps/cft/prepareViewCfTWS.do?resourceId=2875818,2875818,Munster Technological University.,,Thu Dec 21 08:10:53 GMT 2023,Wed Jan 24 12:00:00 GMT 2024,Open,Established,https://www.etenders.gov.ie/epps/cft/downloadNoticeForAdvSearch.do?resourceId=2875818,,,1
1756,**** Cancel: 8702 Qualification System for Trailer Hacker Services,https://www.etenders.gov.ie/epps/dps/prepareViewCfTDPSWS.do?resourceId=2872664,2872664,Iarnród Eireann-Irish Rail,,Thu Dec 21 08:10:42 GMT 2023,,Dynamic Purchasing System,Established,https://www.etenders.gov.ie/epps/cft/downloadNoticeForAdvSearch.do?resourceId=2872664,,2000000.0,1
1757,2023/56 CFT to establish a Multi Party Framework Agreement for the provision of General Construction and Maintenance Related Services - 2 Lots,https://www.etenders.gov.ie/epps/cft/prepareViewCfTWS.do?resourceId=2885456,2885456,Louth and Meath Education and Training Board 1384,,Wed Dec 20 18:17:54 GMT 2023,Tue Feb 06 12:00:00 GMT 2024,Open,Established,https://www.etenders.gov.ie/epps/cft/downloadNoticeForAdvSearch.do?resourceId=2885456,,4000000.0,1
1758,DPS Qualification for Flexible Endoscopes,https://www.etenders.gov.ie/epps/dps/prepareViewCfTDPSWS.do?resourceId=2878480,2878480,Health Service Executive (HSE),,Wed Dec 20 09:17:31 GMT 2023,,Dynamic Purchasing System,Established,,,2.0E7,1
1759,"Single Supplier framework for the Supply, Delivery, Installation and Commission of Sewing Machines and Supplies across the Irish Prison Service Estate.",https://www.etenders.gov.ie/epps/cft/prepareViewCfTWS.do?resourceId=2873005,2873005,Irish Prison Service,,Wed Dec 20 08:11:03 GMT 2023,Tue Jan 30 12:00:00 GMT 2024,Open,Established,https://www.etenders.gov.ie/epps/cft/downloadNoticeForAdvSearch.do?resourceId=2873005,,500000.0,1
1760,DPS for Design and Print Services for temporary exhibitions,https://www.etenders.gov.ie/epps/dps/prepareViewCfTDPSWS.do?resourceId=2861911,2861911,National Gallery of Ireland,,Wed Dec 20 08:10:23 GMT 2023,,Dynamic Purchasing System,Established,https://www.etenders.gov.ie/epps/cft/downloadNoticeForAdvSearch.do?resourceId=2861911,,425000.0,1
