row_number,title,detail_url,resource_id,contracting_authority,info,date_published,submission_deadline,procedure,status,notice_pdf_url,award_date,estimated_value,cycle
524,"DG 08/25 Civils Contractors to form Carparks, Road Crossings and Drainage - Midlands Trail Network EUJTF Westmeath",https://www.etenders.gov.ie/epps/cft/prepareViewCfTWS.do?resourceId=6290868,6290868,Bord na Móna PLC,,Wed Oct 22 11:51:55 IST 2025,Mon Nov 24 12:00:00 GMT 2025,Open,Tender Submission,https://www.etenders.gov.ie/epps/cft/downloadNoticeForAdvSearch.do?resourceId=6290868,,,1
525,"Design, Supply, and Installation of Purpose-Built Residential Cabins for Depaul Ireland",https://www.etenders.gov.ie/epps/cft/prepareViewCfTWS.do?resourceId=6825309,6825309,Depaul_158465,,Wed Oct 22 10:50:51 IST 2025,Wed Nov 26 17:00:00 GMT 2025,Open,Tender Submission,https://www.etenders.gov.ie/epps/cft/downloadNoticeForAdvSearch.do?resourceId=6825309,,,1
526,Supply and Installation of Digital Cutting Table and Related Equipment,https://www.etenders.gov.ie/epps/cft/prepareViewCfTWS.do?resourceId=6830043,6830043,National Library of Ireland,,Wed Oct 22 10:41:28 IST 2025,Thu Nov 27 12:00:00 GMT 2025,Open,Tender Submission,https://www.etenders.gov.ie/epps/cft/downloadNoticeForAdvSearch.do?resourceId=6830043,,150000.0,1
527,Clifden Community School - Special Education Needs Unit Extension,https://www.etenders.gov.ie/epps/cft/prepareViewCfTWS.do?resourceId=6828506,6828506,Clifden Community School,,Wed Oct 22 10:03:28 IST 2025,Fri Nov 28 00:00:00 GMT 2025,Open,Tender Submission,https://www.etenders.gov.ie/epps/cft/downloadNoticeForAdvSearch.do?resourceId=6828506,,2600000.0,1
528,Dealcoholisation System and Pasteuriser Cabinet,https://www.etenders.gov.ie/epps/cft/prepareViewCfTWS.do?resourceId=6824226,6824226,Teagasc - the Agriculture and Food Development Authority,,Wed Oct 22 04:50:37 IST 2025,Mon Nov 24 14:00:00 GMT 2025,Open,Tender Submission,https://www.etenders.gov.ie/epps/cft/downloadNoticeForAdvSearch.do?resourceId=6824226,,,1
529,Outsourced Radiology Services for St. James’s Hospital,https://www.etenders.gov.ie/epps/cft/prepareViewCfTWS.do?resourceId=6816878,6816878,Health Service Executive (HSE),,Wed Oct 22 04:10:29 IST 2025,Tue Nov 25 15:00:00 GMT 2025,Open,Tender Submission,https://www.etenders.gov.ie/epps/cft/downloadNoticeForAdvSearch.do?resourceId=6816878,,6000000.0,1
530,UCDOPP5511 10KV Medium Voltage Network Maintenance,https://www.etenders.gov.ie/epps/cft/prepareViewCfTWS.do?resourceId=6731097,6731097,University College Dublin ( UCD ),,Wed Oct 22 04:10:24 IST 2025,Wed Dec 10 12:00:00 GMT 2025,Open,Tender Submission,https://www.etenders.gov.ie/epps/cft/downloadNoticeForAdvSearch.do?resourceId=6731097,,800000.0,1
531,Supply and Delivery of Automotive Cleaning Equipment,https://www.etenders.gov.ie/epps/cft/prepareViewCfTWS.do?resourceId=6807003,6807003,Irish Defence Forces_1144,,Wed Oct 22 04:01:03 IST 2025,Mon Dec 01 12:00:00 GMT 2025,Open,Tender Submission,https://www.etenders.gov.ie/epps/cft/downloadNoticeForAdvSearch.do?resourceId=6807003,,200000.0,1
532,Supply and Delivery of 2 (Two) New 50/55 seat Coaches,https://www.etenders.gov.ie/epps/cft/prepareViewCfTWS.do?resourceId=6803453,6803453,Irish Defence Forces_1144,,Wed Oct 22 04:00:32 IST 2025,Fri Nov 28 12:00:00 GMT 2025,Open,Tender Submission,https://www.etenders.gov.ie/epps/cft/downloadNoticeForAdvSearch.do?resourceId=6803453,,500000.0,1
533,Request for Tender for the provision of Recruitment Support and Temporary Agency Workers,https://www.etenders.gov.ie/epps/cft/prepareViewCfTWS.do?resourceId=6818050,6818050,Coimisiún na Meán,,Wed Oct 22 03:31:41 IST 2025,Mon Nov 24 17:00:00 GMT 2025,Open,Tender Submission,https://www.etenders.gov.ie/epps/cft/downloadNoticeForAdvSearch.do?resourceId=6818050,,800000.0,1
534,Exhibition Design and Project Management Services for the National Tour of 1926 Census Exhibition and a Commemorative Exhibition,https://www.etenders.gov.ie/epps/cft/prepareViewCfTWS.do?resourceId=6817241,6817241,Department of Culture Communications Sport,,Wed Oct 22 03:22:09 IST 2025,Thu Dec 04 12:00:00 GMT 2025,Open,Tender Submission,https://www.etenders.gov.ie/epps/cft/downloadNoticeForAdvSearch.do?resourceId=6817241,,300000.0,1
535,Establishment of a multi-party framework agreement for the provision of creative services for the Regional Waste Management Planning Offices,https://www.etenders.gov.ie/epps/cft/prepareViewCfTWS.do?resourceId=6672210,6672210,Dublin City Council,,Wed Oct 22 03:21:02 IST 2025,Thu Nov 20 23:45:00 GMT 2025,Competitive with negotiation,Tender Submission,https://www.etenders.gov.ie/epps/cft/downloadNoticeForAdvSearch.do?resourceId=6672210,,3000000.0,1
536,Cork County Council Multi-Party Consultancy Framework (Projects value over €5m) for Design Team Consultancy Services,https://www.etenders.gov.ie/epps/cft/prepareViewCfTWS.do?resourceId=6792705,6792705,Cork County Council,,Wed Oct 22 03:20:28 IST 2025,Fri Nov 21 12:00:00 GMT 2025,Restricted,Tender Submission,https://www.etenders.gov.ie/epps/cft/downloadNoticeForAdvSearch.do?resourceId=6792705,,,1
537,Call for Tender for the provision of Hot Meals under the School Meals Scheme to Scoil Naomh Molaise 18575E,https://www.etenders.gov.ie/epps/cft/prepareViewCfTWS.do?resourceId=6828672,6828672,Scoil Naomh Molaise,,Tue Oct 21 21:42:44 IST 2025,Fri Nov 21 15:00:00 GMT 2025,Open,Tender Submission,https://www.etenders.gov.ie/epps/cft/downloadNoticeForAdvSearch.do?resourceId=6828672,,483974.4,1
538,HSE West Estates - The Willows Swinford - New Fire Alarm and Emergency Lighting systems,https://www.etenders.gov.ie/epps/cft/prepareViewCfTWS.do?resourceId=6824068,6824068,Health Service Executive (HSE),,Tue Oct 21 17:08:12 IST 2025,Tue Nov 18 14:00:00 GMT 2025,Open,Tender Submission,https://www.etenders.gov.ie/epps/cft/downloadNoticeForAdvSearch.do?resourceId=6824068,,,1
539,"HSE West Estates Property Support: Assessment, Development and Delivery of Properties Under Consideration for Lease or Purchase by HSE West (Galway/Mayo/Roscommon)",https://www.etenders.gov.ie/epps/cft/prepareViewCfTWS.do?resourceId=6825987,6825987,Health Service Executive (HSE),,Tue Oct 21 16:49:25 IST 2025,Wed Nov 19 14:00:00 GMT 2025,Open,Tender Submission,https://www.etenders.gov.ie/epps/cft/downloadNoticeForAdvSearch.do?resourceId=6825987,,,1
540,Call for Tender for the provision of Hot Meals under the School Meals Scheme to Scoil Mhuire Gan Smál 17083B,https://www.etenders.gov.ie/epps/cft/prepareViewCfTWS.do?resourceId=6826212,6826212,Scoil Mhuire Gan Smál Inchicore,,Tue Oct 21 16:05:13 IST 2025,Sun Nov 30 15:00:00 GMT 2025,Open,Tender Submission,https://www.etenders.gov.ie/epps/cft/downloadNoticeForAdvSearch.do?resourceId=6826212,,578323.2,1
541,CONTRACT FOR THE ESTABLISHMENT AND OPERATION OF AN IRISH AGROECOLOGICAL LIVING LAB FOR ECOFABULANDS,https://www.etenders.gov.ie/epps/cft/prepareViewCfTWS.do?resourceId=6824639,6824639,University College Dublin ( UCD ),,Tue Oct 21 14:15:22 IST 2025,Thu Nov 20 12:00:00 GMT 2025,Open,Tender Submission,https://www.etenders.gov.ie/epps/cft/downloadNoticeForAdvSearch.do?resourceId=6824639,,160000.0,1
542,"Internal Refurbishment to Gymnasium, Finner Camp, Co. Donegal",https://www.etenders.gov.ie/epps/cft/prepareViewCfTWS.do?resourceId=6823627,6823627,Department of Defence,,Tue Oct 21 13:45:00 IST 2025,Fri Nov 21 12:00:00 GMT 2025,Open,Tender Submission,https://www.etenders.gov.ie/epps/cft/downloadNoticeForAdvSearch.do?resourceId=6823627,,1.0,1
543,Call for tender for the provision of hotmeals under the school meals scheme to St George's Ns 15315J,https://www.etenders.gov.ie/epps/cft/prepareViewCfTWS.do?resourceId=6821767,6821767,St. George's National School (Balbriggan),,Tue Oct 21 13:36:51 IST 2025,Tue Nov 25 15:00:00 GMT 2025,Open,Tender Submission,https://www.etenders.gov.ie/epps/cft/downloadNoticeForAdvSearch.do?resourceId=6821767,,592300.8,1
544,HSE West Estates - Swinford District Hospital - New Fire Alarm and Emergency Lighting systems,https://www.etenders.gov.ie/epps/cft/prepareViewCfTWS.do?resourceId=6822586,6822586,Health Service Executive (HSE),,Tue Oct 21 12:47:53 IST 2025,Tue Nov 18 14:00:00 GMT 2025,Open,Tender Submission,https://www.etenders.gov.ie/epps/cft/downloadNoticeForAdvSearch.do?resourceId=6822586,,,1
545,"Brothers of Charity Clare- Upgrade works to 15 Cappa Drive, Kilrush Co. Clare",https://www.etenders.gov.ie/epps/cft/prepareViewCfTWS.do?resourceId=6822313,6822313,Brothers of Charity Services Ireland,,Tue Oct 21 11:42:37 IST 2025,Tue Nov 25 12:00:00 GMT 2025,Open,Tender Submission,https://www.etenders.gov.ie/epps/cft/downloadNoticeForAdvSearch.do?resourceId=6822313,,,1
546,Archaeology Services - 8-9 Moore Lane,https://www.etenders.gov.ie/epps/cft/prepareViewCfTWS.do?resourceId=6818254,6818254,Office of Public Works (OPW),,Tue Oct 21 11:40:44 IST 2025,Mon Nov 24 12:00:00 GMT 2025,Open,Tender Submission,https://www.etenders.gov.ie/epps/cft/downloadNoticeForAdvSearch.do?resourceId=6818254,,,1
547,"Construction of Engineer Equipment Storage Facility, Custume Barracks, Athlone, Co. Westmeath",https://www.etenders.gov.ie/epps/cft/prepareViewCfTWS.do?resourceId=6821075,6821075,Department of Defence,,Tue Oct 21 10:34:25 IST 2025,Fri Nov 21 12:00:00 GMT 2025,Open,Tender Submission,https://www.etenders.gov.ie/epps/cft/downloadNoticeForAdvSearch.do?resourceId=6821075,,0.0,1
548,HSE West Estates - Ballina District Hospital - New Fire Alarm and Emergency Lighting systems,https://www.etenders.gov.ie/epps/cft/prepareViewCfTWS.do?resourceId=6815387,6815387,Health Service Executive (HSE),,Tue Oct 21 10:34:08 IST 2025,Tue Nov 18 14:00:00 GMT 2025,Open,Tender Submission,https://www.etenders.gov.ie/epps/cft/downloadNoticeForAdvSearch.do?resourceId=6815387,,,1
549,HSE Capital and Estates - Pest Control for Cork South,https://www.etenders.gov.ie/epps/cft/prepareViewCfTWS.do?resourceId=6820682,6820682,Health Service Executive (HSE),,Tue Oct 21 10:11:28 IST 2025,Tue Nov 18 00:00:00 GMT 2025,Open,Tender Submission,https://www.etenders.gov.ie/epps/cft/downloadNoticeForAdvSearch.do?resourceId=6820682,,,1
550,Tralee to Listowel Greenway - Topographical and Lidar Orthographic Survey Services,https://www.etenders.gov.ie/epps/cft/prepareViewCfTWS.do?resourceId=6818919,6818919,Kerry County Council_1204,,Tue Oct 21 09:01:48 IST 2025,Fri Nov 21 15:00:00 GMT 2025,Open,Tender Submission,https://www.etenders.gov.ie/epps/cft/downloadNoticeForAdvSearch.do?resourceId=6818919,,,1
551,"Cliffs of Moher, Coastal Walk Trail Maintenance, Repair and Replacement Works",https://www.etenders.gov.ie/epps/cft/prepareViewCfTWS.do?resourceId=6797369,6797369,Clare County Council,,Tue Oct 21 08:58:53 IST 2025,Tue Nov 25 12:00:00 GMT 2025,Open,Tender Submission,https://www.etenders.gov.ie/epps/cft/downloadNoticeForAdvSearch.do?resourceId=6797369,,,1
552,"Supply of a commercial twin-vehicle spray booth for the Defence Forces (at the Curragh Camp), including installation and on-going technical support",https://www.etenders.gov.ie/epps/cft/prepareViewCfTWS.do?resourceId=6811263,6811263,Irish Defence Forces_1144,,Tue Oct 21 04:40:43 IST 2025,Mon Dec 01 14:00:00 GMT 2025,Open,Tender Submission,https://www.etenders.gov.ie/epps/cft/downloadNoticeForAdvSearch.do?resourceId=6811263,,400000.0,1
553,"Call for Tender for the provision of Hot Meals under the School Meals Scheme to Scoil Naomh Iosaf, Riverstown 13747F",https://www.etenders.gov.ie/epps/cft/prepareViewCfTWS.do?resourceId=6811174,6811174,Scoil Naomh Iosaf,,Tue Oct 21 04:31:16 IST 2025,Mon Nov 24 15:00:00 GMT 2025,Open,Tender Submission,https://www.etenders.gov.ie/epps/cft/downloadNoticeForAdvSearch.do?resourceId=6811174,,1163635.0,1
554,PS3386F Request for Tender to establish a Multi Supplier Framework Agreement for the Provision of Photography and Videography Services comprising Six (6) Lots for the University of Limerick (UL),https://www.etenders.gov.ie/epps/cft/prepareViewCfTWS.do?resourceId=6808538,6808538,Education Procurement Service (EPS),,Tue Oct 21 04:30:48 IST 2025,Mon Nov 24 14:00:00 GMT 2025,Open,Tender Submission,https://www.etenders.gov.ie/epps/cft/downloadNoticeForAdvSearch.do?resourceId=6808538,,480000.0,1
555,"Engineer Led Integrated Design Team Consultancy Services for three (3) Aircraft Hangar Projects at Casement Aerodrome, Baldonnel, Co. Dublin",https://www.etenders.gov.ie/epps/cft/prepareViewCfTWS.do?resourceId=6808225,6808225,Department of Defence,,Tue Oct 21 04:21:15 IST 2025,Thu Dec 04 12:00:00 GMT 2025,Open,Tender Submission,https://www.etenders.gov.ie/epps/cft/downloadNoticeForAdvSearch.do?resourceId=6808225,,1.0,1
556,Tender No 12 Generator Equipment,https://www.etenders.gov.ie/epps/cft/prepareViewCfTWS.do?resourceId=6807846,6807846,The Irish Air Navigation Service,,Tue Oct 21 04:01:25 IST 2025,Mon Nov 24 12:00:00 GMT 2025,Open,Tender Submission,https://www.etenders.gov.ie/epps/cft/downloadNoticeForAdvSearch.do?resourceId=6807846,,650000.0,1
557,Galway County Council Housing Term Maintenance and Refurbishment Contracts 2025-2027,https://www.etenders.gov.ie/epps/cft/prepareViewCfTWS.do?resourceId=6804343,6804343,Galway County Council,,Tue Oct 21 03:33:12 IST 2025,Fri Nov 21 16:00:00 GMT 2025,Open,Tender Submission,https://www.etenders.gov.ie/epps/cft/downloadNoticeForAdvSearch.do?resourceId=6804343,,,1
558,"Establishment of a Single-Party framework agreement per lot for the supply, installation, commissioning, training and maintenance/servicing (where applicable) of Equipment and Consumables for schools",https://www.etenders.gov.ie/epps/cft/prepareViewCfTWS.do?resourceId=6794845,6794845,Kilkenny and Carlow ETB,,Tue Oct 21 03:30:46 IST 2025,Thu Nov 20 12:00:00 GMT 2025,Open,Tender Submission,https://www.etenders.gov.ie/epps/cft/downloadNoticeForAdvSearch.do?resourceId=6794845,,5000000.0,1
559,Managed Support Partner to provide professional support services for the Department of Agriculture Food and the Marine’s Laboratory Information Management System (LIMS),https://www.etenders.gov.ie/epps/cft/prepareViewCfTWS.do?resourceId=6804209,6804209,Department of Agriculture Food and the Marine,,Tue Oct 21 03:21:21 IST 2025,Fri Nov 21 17:00:00 GMT 2025,Open,Tender Submission,https://www.etenders.gov.ie/epps/cft/downloadNoticeForAdvSearch.do?resourceId=6804209,,2000000.0,1
560,Multi Supplier Framework Agreement for the provision of Legal Services,https://www.etenders.gov.ie/epps/cft/prepareViewCfTWS.do?resourceId=6804404,6804404,Digital Manufacturing Ireland,,Tue Oct 21 03:20:39 IST 2025,Fri Nov 21 11:00:00 GMT 2025,Open,Tender Submission,https://www.etenders.gov.ie/epps/cft/downloadNoticeForAdvSearch.do?resourceId=6804404,,470000.0,1
561,RFT for the provision of Intranet Support and Development,https://www.etenders.gov.ie/epps/cft/prepareViewCfTWS.do?resourceId=6795107,6795107,Department of Enterprise Trade and Employment,,Tue Oct 21 03:12:24 IST 2025,Fri Nov 21 12:00:00 GMT 2025,Open,Tender Submission,https://www.etenders.gov.ie/epps/cft/downloadNoticeForAdvSearch.do?resourceId=6795107,,300000.0,1
562,"Design and Construction of the Wilton Project, Cork (Pro271)",https://www.etenders.gov.ie/epps/cft/prepareViewCfTWS.do?resourceId=6795900,6795900,The Land Development Agency,,Tue Oct 21 03:11:35 IST 2025,Wed Nov 19 16:00:00 GMT 2025,Competitive with negotiation,Tender Submission,https://www.etenders.gov.ie/epps/cft/downloadNoticeForAdvSearch.do?resourceId=6795900,,,1
563,"DG 08/25 Civils Contractors to form Carparks, Road Crossings and Drainage - Midlands Trail Network EUJTF",https://www.etenders.gov.ie/epps/cft/prepareViewCfTWS.do?resourceId=6290485,6290485,Bord na Móna PLC,,Mon Oct 20 16:59:10 IST 2025,Thu Nov 20 12:00:00 GMT 2025,Open,Tender Submission,https://www.etenders.gov.ie/epps/cft/downloadNoticeForAdvSearch.do?resourceId=6290485,,,1
564,"Call for Tender for the provision of Hot Meals under the School Meals Scheme to St. Mary's N.S. Carrigaline, Co. Cork 18279A",https://www.etenders.gov.ie/epps/cft/prepareViewCfTWS.do?resourceId=6777645,6777645,St. Mary's Church of Ireland NS,,Mon Oct 20 15:27:54 IST 2025,Wed Nov 26 15:00:00 GMT 2025,Open,Tender Submission,https://www.etenders.gov.ie/epps/cft/downloadNoticeForAdvSearch.do?resourceId=6777645,,358176.0,1
565,HSE 27508 - Provision of services to undertake a review of National and International Literature relating to Wound Care Management and drafting of updated National Wound Management Guidelines for the,https://www.etenders.gov.ie/epps/cft/prepareViewCfTWS.do?resourceId=6808623,6808623,Health Service Executive (HSE),,Mon Oct 20 15:14:07 IST 2025,Mon Nov 24 12:00:00 GMT 2025,Open,Tender Submission,https://www.etenders.gov.ie/epps/cft/downloadNoticeForAdvSearch.do?resourceId=6808623,,,1
566,Gritting Vehicle and Ancillary Equipment,https://www.etenders.gov.ie/epps/cft/prepareViewCfTWS.do?resourceId=6795446,6795446,Dublin Port Company_411,,Mon Oct 20 13:42:24 IST 2025,Wed Nov 26 12:00:00 GMT 2025,Open,Tender Submission,https://www.etenders.gov.ie/epps/cft/downloadNoticeForAdvSearch.do?resourceId=6795446,,300000.0,1
567,Industrial Cold Press Juicing Machine,https://www.etenders.gov.ie/epps/cft/prepareViewCfTWS.do?resourceId=6807795,6807795,Sillis Green Veg Ltd.,,Mon Oct 20 11:55:20 IST 2025,Tue Nov 25 17:00:00 GMT 2025,Open,Tender Submission,https://www.etenders.gov.ie/epps/cft/downloadNoticeForAdvSearch.do?resourceId=6807795,,100000.0,1
568,Public Lighting Consultant and Associated Works for Kildare County Council,https://www.etenders.gov.ie/epps/cft/prepareViewCfTWS.do?resourceId=6788567,6788567,Kildare County Council_385,,Mon Oct 20 10:15:01 IST 2025,Thu Nov 20 16:00:00 GMT 2025,Open,Tender Submission,https://www.etenders.gov.ie/epps/cft/downloadNoticeForAdvSearch.do?resourceId=6788567,,50000.0,1
569,RFT For Knife Peeling Machine,https://www.etenders.gov.ie/epps/cft/prepareViewCfTWS.do?resourceId=6806894,6806894,Sillis Green Veg Ltd.,,Mon Oct 20 09:11:35 IST 2025,Tue Nov 25 17:00:00 GMT 2025,Open,Tender Submission,https://www.etenders.gov.ie/epps/cft/downloadNoticeForAdvSearch.do?resourceId=6806894,,200000.0,1
570,"Roof Maintenance, Repair and Refurbishment Works Contract at South East Technological University Waterford ( SETU )",https://www.etenders.gov.ie/epps/cft/prepareViewCfTWS.do?resourceId=6795399,6795399,South East Technological University (SETU),,Mon Oct 20 04:21:13 IST 2025,Mon Nov 24 12:00:00 GMT 2025,Open,Tender Submission,https://www.etenders.gov.ie/epps/cft/downloadNoticeForAdvSearch.do?resourceId=6795399,,900000.0,1
571,Call for Tender for the provision of Hot Meals under the School Meals Scheme to Adamstown Castle Educate Together National School 20268H,https://www.etenders.gov.ie/epps/cft/prepareViewCfTWS.do?resourceId=6794505,6794505,Adamstown Castle Educate Together National School,,Mon Oct 20 04:10:36 IST 2025,Thu Nov 20 15:00:00 GMT 2025,Open,Tender Submission,https://www.etenders.gov.ie/epps/cft/downloadNoticeForAdvSearch.do?resourceId=6794505,,754791.0,1
572,Supply of Automotive Electrical Spare Parts and Accessories including Vehicle Electrical Repairs to the Defence Forces.,https://www.etenders.gov.ie/epps/cft/prepareViewCfTWS.do?resourceId=6793341,6793341,Irish Defence Forces_1144,,Mon Oct 20 04:01:35 IST 2025,Fri Nov 28 12:00:00 GMT 2025,Open,Tender Submission,https://www.etenders.gov.ie/epps/cft/downloadNoticeForAdvSearch.do?resourceId=6793341,,1000000.0,1
573,15 Cappa Drive - Upgrade and Renovation works,https://www.etenders.gov.ie/epps/cft/prepareViewCfTWS.do?resourceId=6793028,6793028,Brothers of Charity Services Ireland,,Mon Oct 20 03:40:54 IST 2025,Fri Nov 21 15:00:00 GMT 2025,Open,Tender Submission,https://www.etenders.gov.ie/epps/cft/downloadNoticeForAdvSearch.do?resourceId=6793028,,,1
574,15 Cappa Drive,https://www.etenders.gov.ie/epps/cft/prepareViewCfTWS.do?resourceId=6770823,6770823,Brothers of Charity Services Ireland,,Mon Oct 20 03:31:39 IST 2025,Fri Nov 21 16:00:00 GMT 2025,Open,Tender Submission,https://www.etenders.gov.ie/epps/cft/downloadNoticeForAdvSearch.do?resourceId=6770823,,,1
575,The Establishment of 2 Multi-Operator Framework Agreements for Intermediate Works Projects (Lot 1) and Large Works Projects (Lot 2) for the delivery of Capital Works Programmes across TUS campuses,https://www.etenders.gov.ie/epps/cft/prepareViewCfTWS.do?resourceId=6771251,6771251,Technological University of the Shannon: Midlands Midwest (TUSMM),,Mon Oct 20 03:30:59 IST 2025,Wed Dec 03 13:00:00 GMT 2025,Restricted,Tender Submission,https://www.etenders.gov.ie/epps/cft/downloadNoticeForAdvSearch.do?resourceId=6771251,,6.5E7,1
576,"Construction Contract for Two Classrooms and One Multi-Purpose Room with Circulation connection to existing school at Scoil Eoin, Innishannon, Co Cork",https://www.etenders.gov.ie/epps/cft/prepareViewCfTWS.do?resourceId=6803897,6803897,Scoil Eoin (Innishannon),,Fri Oct 17 17:49:55 IST 2025,Fri Nov 21 16:30:00 GMT 2025,Open,Tender Submission,https://www.etenders.gov.ie/epps/cft/downloadNoticeForAdvSearch.do?resourceId=6803897,,,1
577,Call for tenders for the provision of a Contract Lifecycle Management Solution to the Rehab Group,https://www.etenders.gov.ie/epps/cft/prepareViewCfTWS.do?resourceId=6800922,6800922,The Rehab Group,,Fri Oct 17 14:58:40 IST 2025,Fri Nov 28 00:00:00 GMT 2025,Open,Tender Submission,https://www.etenders.gov.ie/epps/cft/downloadNoticeForAdvSearch.do?resourceId=6800922,,180000.0,1
578,"Design and Construction of Bowling Green at SOS Kilkenny Campus, Callan Road, Kilkenny, Co Kilkenny. Ireland",https://www.etenders.gov.ie/epps/cft/prepareViewCfTWS.do?resourceId=6800675,6800675,SOS Kilkenny clg,,Fri Oct 17 14:47:23 IST 2025,Wed Dec 17 14:00:00 GMT 2025,Open,Tender Submission,https://www.etenders.gov.ie/epps/cft/downloadNoticeForAdvSearch.do?resourceId=6800675,,140000.0,1
579,"Construction of Infill housing at Rathmullen Park, Drogheda, Co. Louth",https://www.etenders.gov.ie/epps/cft/prepareViewCfTWS.do?resourceId=6787637,6787637,Louth County Council_381,,Fri Oct 17 13:49:13 IST 2025,Fri Nov 28 00:00:00 GMT 2025,Open,Tender Submission,https://www.etenders.gov.ie/epps/cft/downloadNoticeForAdvSearch.do?resourceId=6787637,,,1
580,"Contract for Services for Cataloguing of historical records in the National Archives, Ireland",https://www.etenders.gov.ie/epps/cft/prepareViewCfTWS.do?resourceId=6796620,6796620,Department of Culture Communications Sport,,Fri Oct 17 12:32:24 IST 2025,Mon Nov 24 12:30:00 GMT 2025,Open,Tender Submission,https://www.etenders.gov.ie/epps/cft/downloadNoticeForAdvSearch.do?resourceId=6796620,,112000.0,1
581,RfT 17/10/2025 for a Post-Graduate Certificate/Diploma Programme of Continuing Professional Development for Teachers working with Students with Special Educational Needs (Autism),https://www.etenders.gov.ie/epps/cft/prepareViewCfTWS.do?resourceId=6780538,6780538,National Council for Special Education,,Fri Oct 17 10:54:42 IST 2025,Fri Nov 21 14:00:00 GMT 2025,Open,Tender Submission,https://www.etenders.gov.ie/epps/cft/downloadNoticeForAdvSearch.do?resourceId=6780538,,120000.0,1
582,The provision of GitLab licences,https://www.etenders.gov.ie/epps/cft/prepareViewCfTWS.do?resourceId=6750162,6750162,Department of Agriculture Food and the Marine,,Fri Oct 17 04:21:08 IST 2025,Thu Nov 20 14:00:00 GMT 2025,Open,Tender Submission,https://www.etenders.gov.ie/epps/cft/downloadNoticeForAdvSearch.do?resourceId=6750162,,470000.0,1
583,"TR4407 - Planning, Consenting and Environmental Services Qualification System",https://www.etenders.gov.ie/epps/dps/prepareViewCfTDPSWS.do?resourceId=6767600,6767600,Electricity Supply Board ( ESB ),,Fri Oct 17 04:10:52 IST 2025,,Qualification System,Established,https://www.etenders.gov.ie/epps/cft/downloadNoticeForAdvSearch.do?resourceId=6767600,,,1
584,DPS for the provision of vehicles and vehicle adaptation services for Cope Foundation (Horizons),https://www.etenders.gov.ie/epps/dps/prepareViewCfTDPSWS.do?resourceId=6756175,6756175,COPE Foundation,,Fri Oct 17 03:30:43 IST 2025,,Dynamic Purchasing System,Established,https://www.etenders.gov.ie/epps/cft/downloadNoticeForAdvSearch.do?resourceId=6756175,,1250000.0,1
585,CLG Ghaoth Dobhair Window And Door Replacement,https://www.etenders.gov.ie/epps/cft/prepareViewCfTWS.do?resourceId=6739195,6739195,CLGGhaothDobhair,,Thu Oct 16 22:08:23 IST 2025,Fri Nov 21 14:00:00 GMT 2025,Open,Tender Submission,https://www.etenders.gov.ie/epps/cft/downloadNoticeForAdvSearch.do?resourceId=6739195,,,1
586,Digital media services for the National Archives’ social media platforms,https://www.etenders.gov.ie/epps/cft/prepareViewCfTWS.do?resourceId=6787123,6787123,Department of Culture Communications Sport,,Thu Oct 16 17:24:44 IST 2025,Mon Dec 01 12:00:00 GMT 2025,Open,Tender Submission,https://www.etenders.gov.ie/epps/cft/downloadNoticeForAdvSearch.do?resourceId=6787123,,150000.0,1
587,"Drumboe Woods Park Development, Phase 1, Stranorlar, Co. Donegal",https://www.etenders.gov.ie/epps/cft/prepareViewCfTWS.do?resourceId=6759910,6759910,Donegal County Council_1193,,Thu Oct 16 16:10:28 IST 2025,Mon Nov 24 12:00:00 GMT 2025,Open,Tender Submission,https://www.etenders.gov.ie/epps/cft/downloadNoticeForAdvSearch.do?resourceId=6759910,,480000.0,1
588,Internal Auditor / Iniúchóir Inmheánach Foras na Gaeilge,https://www.etenders.gov.ie/epps/cft/prepareViewCfTWS.do?resourceId=6788417,6788417,Foras na Gaeilge,,Thu Oct 16 15:39:40 IST 2025,Fri Nov 21 12:00:00 GMT 2025,Open,Tender Submission,https://www.etenders.gov.ie/epps/cft/downloadNoticeForAdvSearch.do?resourceId=6788417,,40000.0,1
