row_number,title,detail_url,resource_id,contracting_authority,info,date_published,submission_deadline,procedure,status,notice_pdf_url,award_date,estimated_value,cycle
1097,Single Party Framework Agreement for Coaching Services,https://www.etenders.gov.ie/epps/cft/prepareViewCfTWS.do?resourceId=4736472,4736472,Fáilte Ireland-National Tourism Development Authority,,Thu Nov 21 16:58:45 GMT 2024,Fri Dec 13 12:00:00 GMT 2024,Open,Established,https://www.etenders.gov.ie/epps/cft/downloadNoticeForAdvSearch.do?resourceId=4736472,,60000.0,1
1098,HEAnet Recruitment Services,https://www.etenders.gov.ie/epps/cft/prepareViewCfTWS.do?resourceId=4725603,4725603,HEAnet CLG,,Thu Nov 21 07:51:53 GMT 2024,Mon Jan 06 16:00:00 GMT 2025,Open,Established,https://www.etenders.gov.ie/epps/cft/downloadNoticeForAdvSearch.do?resourceId=4725603,,750000.0,1
1099,"24/010 - Provision of Telemetry, Instrumentation, Metering and Analytical Equipment",https://www.etenders.gov.ie/epps/dps/prepareViewCfTDPSWS.do?resourceId=4704901,4704901,Gas Networks Ireland,,Wed Nov 20 08:42:41 GMT 2024,,Qualification System,Established,https://www.etenders.gov.ie/epps/cft/downloadNoticeForAdvSearch.do?resourceId=4704901,,,1
1100,Single Party Framework Agreement for the Provision of Milestone and Commend Licensing and Maintenance Support for TU Dublin,https://www.etenders.gov.ie/epps/cft/prepareViewCfTWS.do?resourceId=4715316,4715316,Technological University Dublin (TU Dublin),,Tue Nov 19 12:21:54 GMT 2024,Tue Dec 10 14:00:00 GMT 2024,Open,Established,https://www.etenders.gov.ie/epps/cft/downloadNoticeForAdvSearch.do?resourceId=4715316,,180000.0,1
1101,"Dublin City Council Single Party Framework Agreement for Project Management Services for the redevelopment of sport and recreation facilities at Irishtown, Dublin 4 and Kilmore, Dublin 5",https://www.etenders.gov.ie/epps/cft/prepareViewCfTWS.do?resourceId=4624096,4624096,Dublin City Council,,Tue Nov 19 08:10:21 GMT 2024,Wed Dec 18 17:00:00 GMT 2024,Open,Established,https://www.etenders.gov.ie/epps/cft/downloadNoticeForAdvSearch.do?resourceId=4624096,,,1
1102,PS3133F - RFT to Establish a Multi-Supplier Framework Agreement for the Provision of Photography Services for Trinity College Dublin,https://www.etenders.gov.ie/epps/cft/prepareViewCfTWS.do?resourceId=4712181,4712181,Education Procurement Service (EPS),,Mon Nov 18 17:17:23 GMT 2024,Wed Dec 11 14:00:00 GMT 2024,Open,Established,https://www.etenders.gov.ie/epps/cft/downloadNoticeForAdvSearch.do?resourceId=4712181,,200000.0,1
1103,Multi-Party Framework Agreement for Housing Regeneration Works and Housing Adaption Grants 2024 within the Kildare County Council Administrative Area across two (2) Lots.,https://www.etenders.gov.ie/epps/cft/prepareViewCfTWS.do?resourceId=4697610,4697610,Kildare County Council_385,,Mon Nov 18 08:01:15 GMT 2024,Fri Jan 17 12:00:00 GMT 2025,Open,Established,https://www.etenders.gov.ie/epps/cft/downloadNoticeForAdvSearch.do?resourceId=4697610,,1.5E7,1
1104,"CL3028DPS - Dynamic Purchasing System for the Supply of Schoolbooks incl eBooks to Community and Comprehensive, and Voluntary Secondary Schools (excluding ETB schools) within the Free Education Scheme",https://www.etenders.gov.ie/epps/dps/prepareViewCfTDPSWS.do?resourceId=4688326,4688326,Education Procurement Service (EPS),,Mon Nov 18 07:52:16 GMT 2024,,Dynamic Purchasing System,Established,https://www.etenders.gov.ie/epps/cft/downloadNoticeForAdvSearch.do?resourceId=4688326,,4.2E8,1
1105,24/009 - Provision of Electrical Power Systems,https://www.etenders.gov.ie/epps/dps/prepareViewCfTDPSWS.do?resourceId=4692377,4692377,Gas Networks Ireland,,Mon Nov 18 07:51:35 GMT 2024,,Qualification System,Established,https://www.etenders.gov.ie/epps/cft/downloadNoticeForAdvSearch.do?resourceId=4692377,,,1
1106,Multi Supplier Framework for the Supply of Engineering Consumables for Waterford and Wexford Education and Training Board V2,https://www.etenders.gov.ie/epps/cft/prepareViewCfTWS.do?resourceId=4690633,4690633,Waterford and Wexford Education and Training Board_110494,,Mon Nov 18 07:50:58 GMT 2024,Mon Dec 16 17:00:00 GMT 2024,Open,Established,https://www.etenders.gov.ie/epps/cft/downloadNoticeForAdvSearch.do?resourceId=4690633,,2600000.0,1
1107,Supply of Electric Vehicle Passenger Cars to Teagasc,https://www.etenders.gov.ie/epps/cft/prepareViewCfTWS.do?resourceId=4701204,4701204,Teagasc - the Agriculture and Food Development Authority,,Fri Nov 15 16:43:21 GMT 2024,Tue Dec 03 14:00:00 GMT 2024,Open,Established,https://www.etenders.gov.ie/epps/cft/downloadNoticeForAdvSearch.do?resourceId=4701204,,,1
1108,IT3084F - Official Digital Documents System- UL,https://www.etenders.gov.ie/epps/cft/prepareViewCfTWS.do?resourceId=4688868,4688868,Education Procurement Service (EPS),,Fri Nov 15 07:51:31 GMT 2024,Mon Dec 16 12:00:00 GMT 2024,Open,Established,https://www.etenders.gov.ie/epps/cft/downloadNoticeForAdvSearch.do?resourceId=4688868,,1200000.0,1
1109,Single-Party Framework Agreement for the provision of comprehensive pension administration services on an outsourced basis to the Institute of Public Administration,https://www.etenders.gov.ie/epps/cft/prepareViewCfTWS.do?resourceId=4673848,4673848,Institute of Public Administration_299,,Thu Nov 14 07:50:19 GMT 2024,Wed Dec 18 12:00:00 GMT 2024,Open,Established,https://www.etenders.gov.ie/epps/cft/downloadNoticeForAdvSearch.do?resourceId=4673848,,260000.0,1
1110,Live weight recording of beef cattle on commercial farms,https://www.etenders.gov.ie/epps/cft/prepareViewCfTWS.do?resourceId=4683328,4683328,Teagasc - the Agriculture and Food Development Authority,,Wed Nov 13 13:50:14 GMT 2024,Tue Dec 03 14:00:00 GMT 2024,Open,Established,https://www.etenders.gov.ie/epps/cft/downloadNoticeForAdvSearch.do?resourceId=4683328,,,1
1111,"Invitation to Tender for the Framework Agreement for the Procurement of Architectural Services for Type 3 Projects, for Kildare, Dún Laoghaire-Rathdown, and Wexford County Councils.",https://www.etenders.gov.ie/epps/cft/prepareViewCfTWS.do?resourceId=4673035,4673035,Kildare County Council_385,,Wed Nov 13 07:50:34 GMT 2024,Fri Jan 31 14:00:00 GMT 2025,Open,Established,https://www.etenders.gov.ie/epps/cft/downloadNoticeForAdvSearch.do?resourceId=4673035,,2.7E7,1
1112,Delivery of a Career Coaching Programme for the International Financial Services (IFS) Sector,https://www.etenders.gov.ie/epps/cft/prepareViewCfTWS.do?resourceId=4675102,4675102,IFS Skillnet,,Tue Nov 12 12:37:12 GMT 2024,Mon Dec 09 12:00:00 GMT 2024,Open,Established,https://www.etenders.gov.ie/epps/cft/downloadNoticeForAdvSearch.do?resourceId=4675102,,220000.0,1
1113,"DPS for the provision of Surgical Attire, Drapes, Anaesthetic Consumables, Sutures, Theatre Consumables, CSSD Consumables, to include all related Consumables HSE Ref 16766/23899",https://www.etenders.gov.ie/epps/dps/prepareViewCfTDPSWS.do?resourceId=4559702,4559702,Health Service Executive (HSE),,Tue Nov 12 12:36:30 GMT 2024,,Dynamic Purchasing System,Established,https://www.etenders.gov.ie/epps/cft/downloadNoticeForAdvSearch.do?resourceId=4559702,,1.28E8,1
1114,DCC Request for Tender Provision of Services for football pitch Maintenance at Dalymount Park Football Stadium (Lot 1) and Irishtown Stadium (Lot 2),https://www.etenders.gov.ie/epps/cft/prepareViewCfTWS.do?resourceId=4610598,4610598,Dublin City Council,,Mon Nov 11 07:52:49 GMT 2024,Mon Dec 09 12:00:00 GMT 2024,Open,Established,https://www.etenders.gov.ie/epps/cft/downloadNoticeForAdvSearch.do?resourceId=4610598,,300000.0,1
1115,Recruitment Agencies Framework for SEAI,https://www.etenders.gov.ie/epps/cft/prepareViewCfTWS.do?resourceId=4622215,4622215,Sustainable Energy Authority of Ireland,,Mon Nov 11 07:51:04 GMT 2024,Mon Dec 09 12:00:00 GMT 2024,Open,Established,https://www.etenders.gov.ie/epps/cft/downloadNoticeForAdvSearch.do?resourceId=4622215,,1.2E7,1
1116,Tipperary CoCo _ Multi-Party Framework Agreement for - The Provision of Occupational Therapy (OT) Services,https://www.etenders.gov.ie/epps/cft/prepareViewCfTWS.do?resourceId=4632077,4632077,Tipperary County Council,,Fri Nov 08 07:51:05 GMT 2024,Thu Dec 05 12:00:00 GMT 2024,Open,Established,https://www.etenders.gov.ie/epps/cft/downloadNoticeForAdvSearch.do?resourceId=4632077,,,1
1117,CFT 3721 – SPFA for Supply of Motor Vehicle Parts to South Dublin County Council,https://www.etenders.gov.ie/epps/cft/prepareViewCfTWS.do?resourceId=4634035,4634035,South Dublin County Council,,Fri Nov 08 07:50:45 GMT 2024,Mon Dec 09 16:00:00 GMT 2024,Open,Established,https://www.etenders.gov.ie/epps/cft/downloadNoticeForAdvSearch.do?resourceId=4634035,,700000.0,1
1118,2024/72 Multi Supplier Framework Agreement for the supply of Beauty Equipment,https://www.etenders.gov.ie/epps/cft/prepareViewCfTWS.do?resourceId=4619174,4619174,Louth and Meath Education and Training Board 1384,,Thu Nov 07 13:02:55 GMT 2024,Thu Nov 28 12:00:00 GMT 2024,Open,Established,https://www.etenders.gov.ie/epps/cft/downloadNoticeForAdvSearch.do?resourceId=4619174,,221000.0,1
1119,"Single Party Framework Agreement for the supply delivery, design, build/fit out of District Command and control vehicles specifically for Dublin Fire Brigade",https://www.etenders.gov.ie/epps/cft/prepareViewCfTWS.do?resourceId=4481959,4481959,Dublin City Council,,Thu Nov 07 07:53:47 GMT 2024,Fri Jan 03 12:00:00 GMT 2025,Open,Established,https://www.etenders.gov.ie/epps/cft/downloadNoticeForAdvSearch.do?resourceId=4481959,,500000.0,1
1120,Single Party Framework Agreement for the Supply and Delivery of medical and first aid consumables to Dublin Fire Brigade and Dublin City Council,https://www.etenders.gov.ie/epps/cft/prepareViewCfTWS.do?resourceId=4481835,4481835,Dublin City Council,,Thu Nov 07 07:52:32 GMT 2024,Fri Dec 06 12:00:00 GMT 2024,Open,Established,https://www.etenders.gov.ie/epps/cft/downloadNoticeForAdvSearch.do?resourceId=4481835,,5000000.0,1
1121,Kerdiffstown Bus Tender October 2024,https://www.etenders.gov.ie/epps/cft/prepareViewCfTWS.do?resourceId=4598585,4598585,Peter McVerry Trust_121127,,Wed Nov 06 08:40:42 GMT 2024,Wed Nov 06 00:00:00 GMT 2024,Open,Tender Submission,https://www.etenders.gov.ie/epps/cft/downloadNoticeForAdvSearch.do?resourceId=4598585,,135000.0,1
1122,SOUTH EAST FRAMEWORK FOR PAVEMENT AND ASSOCIATED MINOR WORKS,https://www.etenders.gov.ie/epps/cft/prepareViewCfTWS.do?resourceId=4605764,4605764,Kilkenny County Council_1185,,Tue Nov 05 18:21:18 GMT 2024,Fri Dec 06 15:00:00 GMT 2024,Open,Established,https://www.etenders.gov.ie/epps/cft/downloadNoticeForAdvSearch.do?resourceId=4605764,,1.0E8,1
1123,Single Supplier Framework for the delivery of International Business Field Trips to MTU,https://www.etenders.gov.ie/epps/cft/prepareViewCfTWS.do?resourceId=4549455,4549455,Munster Technological University.,,Tue Nov 05 12:02:34 GMT 2024,Mon Nov 25 12:00:00 GMT 2024,Open,Established,https://www.etenders.gov.ie/epps/cft/downloadNoticeForAdvSearch.do?resourceId=4549455,,,1
1124,DPS for asset management and associated services,https://www.etenders.gov.ie/epps/dps/prepareViewCfTDPSWS.do?resourceId=2055576,2055576,Co-operative Housing Ireland,,Tue Nov 05 10:40:36 GMT 2024,,Dynamic Purchasing System,Established,,Mon May 01 00:00:00 IST 2023,1.16E7,1
1125,"Single Party Framework for LAN and WAN maintenance, support, network upgrade and IT security infrastructure for Kildare County Council",https://www.etenders.gov.ie/epps/cft/prepareViewCfTWS.do?resourceId=4595475,4595475,Kildare County Council_385,,Mon Nov 04 09:33:50 GMT 2024,Mon Dec 02 12:00:00 GMT 2024,Open,Established,https://www.etenders.gov.ie/epps/cft/downloadNoticeForAdvSearch.do?resourceId=4595475,,750000.0,1
1126,2024/76 CFT Single Party Framework for Project Management Services,https://www.etenders.gov.ie/epps/cft/prepareViewCfTWS.do?resourceId=4606261,4606261,Louth and Meath Education and Training Board 1384,,Fri Nov 01 16:12:15 GMT 2024,Fri Nov 22 12:00:00 GMT 2024,Open,Established,https://www.etenders.gov.ie/epps/cft/downloadNoticeForAdvSearch.do?resourceId=4606261,,130000.0,1
1127,2024/67 CFT Single Party Framework for Smart Factory Curriculum Development,https://www.etenders.gov.ie/epps/cft/prepareViewCfTWS.do?resourceId=4605836,4605836,Louth and Meath Education and Training Board 1384,,Fri Nov 01 15:47:59 GMT 2024,Fri Nov 22 12:00:00 GMT 2024,Open,Established,https://www.etenders.gov.ie/epps/cft/downloadNoticeForAdvSearch.do?resourceId=4605836,,160000.0,1
1128,"Kerry, South Cork, Cork North and West Local Enterprise Offices Digital For Business Programme",https://www.etenders.gov.ie/epps/cft/prepareViewCfTWS.do?resourceId=4604377,4604377,Kerry County Council_1204,,Fri Nov 01 15:16:16 GMT 2024,Fri Nov 22 16:00:00 GMT 2024,Open,Established,https://www.etenders.gov.ie/epps/cft/downloadNoticeForAdvSearch.do?resourceId=4604377,,,1
1129,CFT 3711 – MPFA for the provision of technical consultancy services for the development of all-weather sports facilities with the initial contract for 2 No. GAA sized Artificial Grass Pitches,https://www.etenders.gov.ie/epps/cft/prepareViewCfTWS.do?resourceId=4582177,4582177,South Dublin County Council,,Thu Oct 31 08:51:38 GMT 2024,Tue Dec 03 16:00:00 GMT 2024,Open,Established,https://www.etenders.gov.ie/epps/cft/downloadNoticeForAdvSearch.do?resourceId=4582177,,500000.0,1
1130,"SPFW for The Provision of Support, Maintenance, Development and Enhancements Services for Oracle EBS, to include a period of discovery and handover with DCC’s current support partner, Fujitsu",https://www.etenders.gov.ie/epps/cft/prepareViewCfTWS.do?resourceId=4416843,4416843,Dublin City Council,,Thu Oct 31 08:50:56 GMT 2024,Wed Dec 11 17:00:00 GMT 2024,Open,Established,https://www.etenders.gov.ie/epps/cft/downloadNoticeForAdvSearch.do?resourceId=4416843,,1.0E7,1
1131,Training Panel 2025-2027 - National Organic Training Skillnet,https://www.etenders.gov.ie/epps/cft/prepareViewCfTWS.do?resourceId=4478853,4478853,National Organic Training Skillnet,,Wed Oct 30 14:42:22 GMT 2024,Thu Dec 31 18:00:00 GMT 2026,Open,Tender Submission,https://www.etenders.gov.ie/epps/cft/downloadNoticeForAdvSearch.do?resourceId=4478853,,,1
1132,Temperature Controlled Supply Chain Management Services,https://www.etenders.gov.ie/epps/dps/prepareViewCfTDPSWS.do?resourceId=4259020,4259020,Health Service Executive (HSE),,Wed Oct 30 08:21:26 GMT 2024,,Dynamic Purchasing System,Established,https://www.etenders.gov.ie/epps/cft/downloadNoticeForAdvSearch.do?resourceId=4259020,,8.0E7,1
1133,Tender for a Multi Supplier Framework Agreement for the Provision of Structured Cabling Services to Rehab Group Centres.,https://www.etenders.gov.ie/epps/cft/prepareViewCfTWS.do?resourceId=4582062,4582062,The Rehab Group,,Tue Oct 29 15:07:37 GMT 2024,Fri Dec 06 12:00:00 GMT 2024,Open,Established,https://www.etenders.gov.ie/epps/cft/downloadNoticeForAdvSearch.do?resourceId=4582062,,80000.0,1
1134,"ITC016F Multi Supplier Framework Agreement for the provision of Network and Firewall Products, Solutions, Ancillary Equipment and Associated Services",https://www.etenders.gov.ie/epps/cft/prepareViewCfTWS.do?resourceId=4574076,4574076,The Office of Government Procurement,,Tue Oct 29 08:11:15 GMT 2024,Mon Dec 16 11:00:00 GMT 2024,Open,Established,https://www.etenders.gov.ie/epps/cft/downloadNoticeForAdvSearch.do?resourceId=4574076,,7.5E7,1
1135,Harvesting DPS 2025-2035,https://www.etenders.gov.ie/epps/dps/prepareViewCfTDPSWS.do?resourceId=2982081,2982081,Coillte CGA,,Tue Oct 29 08:10:23 GMT 2024,,Dynamic Purchasing System,Established,https://www.etenders.gov.ie/epps/cft/downloadNoticeForAdvSearch.do?resourceId=2982081,,5.0E8,1
1136,Achilles Qualification System Notice - Supply-Line Qualification System for Supplies October 2024.,https://www.etenders.gov.ie/epps/dps/prepareViewCfTDPSWS.do?resourceId=4556792,4556792,Achilles Procurement Services Ltd (Buyer),,Mon Oct 28 08:21:23 GMT 2024,,Qualification System,Established,https://www.etenders.gov.ie/epps/cft/downloadNoticeForAdvSearch.do?resourceId=4556792,,,1
1137,Achilles Qualification System Notice - Supply-Line Qualification System for Works October 2024,https://www.etenders.gov.ie/epps/dps/prepareViewCfTDPSWS.do?resourceId=4556752,4556752,Achilles Procurement Services Ltd (Buyer),,Mon Oct 28 08:20:55 GMT 2024,,Qualification System,Established,https://www.etenders.gov.ie/epps/cft/downloadNoticeForAdvSearch.do?resourceId=4556752,,,1
1138,Achilles Qualification System Notice - Supply-Line Qualification System for Services incl. Engineering Services October 2024,https://www.etenders.gov.ie/epps/dps/prepareViewCfTDPSWS.do?resourceId=4539241,4539241,Achilles Procurement Services Ltd (Buyer),,Mon Oct 28 08:20:32 GMT 2024,,Qualification System,Established,https://www.etenders.gov.ie/epps/cft/downloadNoticeForAdvSearch.do?resourceId=4539241,,,1
1139,Placement Management System for Trinity College Dublin,https://www.etenders.gov.ie/epps/cft/prepareViewCfTWS.do?resourceId=4526419,4526419,Trinity College Dublin the University of Dublin_336,,Fri Oct 25 08:02:20 IST 2024,Wed Nov 20 14:00:00 GMT 2024,Open,Established,https://www.etenders.gov.ie/epps/cft/downloadNoticeForAdvSearch.do?resourceId=4526419,,227000.0,1
1140,KCETB invite submissions for the re-advertisement of the Panel of Companies to provide Coach/Bus Hire services to transport staff and students to a range of off site destinations nationwide,https://www.etenders.gov.ie/epps/dps/prepareViewCfTDPSWS.do?resourceId=4554863,4554863,Kilkenny and Carlow ETB,,Fri Oct 25 08:00:55 IST 2024,,Dynamic Purchasing System,Established,https://www.etenders.gov.ie/epps/cft/downloadNoticeForAdvSearch.do?resourceId=4554863,,750000.0,1
1141,The provision of Sessional Psychotherapy Panel services for TU Dublin,https://www.etenders.gov.ie/epps/dps/prepareViewCfTDPSWS.do?resourceId=4561839,4561839,Technological University Dublin (TU Dublin),,Thu Oct 24 15:16:07 IST 2024,,Dynamic Purchasing System,Established,https://www.etenders.gov.ie/epps/cft/downloadNoticeForAdvSearch.do?resourceId=4561839,,400000.0,1
1142,2024 71 Multi Party Framework Agreement for the Supply Delivery of Hairdressing and Barbering Products,https://www.etenders.gov.ie/epps/cft/prepareViewCfTWS.do?resourceId=4561612,4561612,Louth and Meath Education and Training Board 1384,,Thu Oct 24 14:20:58 IST 2024,Thu Nov 14 12:00:00 GMT 2024,Open,Established,https://www.etenders.gov.ie/epps/cft/downloadNoticeForAdvSearch.do?resourceId=4561612,,221000.0,1
1143,2024 60 Multi Party Framework Agreement for the Supply and Delivery of Hairdressing and Barbering Equipment,https://www.etenders.gov.ie/epps/cft/prepareViewCfTWS.do?resourceId=4561325,4561325,Louth and Meath Education and Training Board 1384,,Thu Oct 24 14:04:29 IST 2024,Thu Nov 14 12:00:00 GMT 2024,Open,Established,https://www.etenders.gov.ie/epps/cft/downloadNoticeForAdvSearch.do?resourceId=4561325,,221000.0,1
1144,Sign Language Interpretation Service Provider Panel,https://www.etenders.gov.ie/epps/cft/prepareViewCfTWS.do?resourceId=4560117,4560117,Waterford and Wexford Education and Training Board_110494,,Thu Oct 24 12:42:55 IST 2024,Tue Dec 22 13:00:00 GMT 2026,Open,Tender Submission,https://www.etenders.gov.ie/epps/cft/downloadNoticeForAdvSearch.do?resourceId=4560117,,100000.0,1
1145,DPS for Supply of Materials for the Conservation Archiving Transport and Storage of Museum Collections 2024 - 2031,https://www.etenders.gov.ie/epps/dps/prepareViewCfTDPSWS.do?resourceId=4546463,4546463,National Museum of Ireland,,Thu Oct 24 08:22:01 IST 2024,,Dynamic Purchasing System,Established,https://www.etenders.gov.ie/epps/cft/downloadNoticeForAdvSearch.do?resourceId=4546463,,425000.0,1
1146,The Supply and Delivery of Electrical Consumables to Galway and Roscommon Education and Training Board - Two (2) Lots,https://www.etenders.gov.ie/epps/cft/prepareViewCfTWS.do?resourceId=4546142,4546142,Galway Roscommon Education and Training Board_92189,,Thu Oct 24 08:21:29 IST 2024,Thu Nov 28 12:00:00 GMT 2024,Open,Established,https://www.etenders.gov.ie/epps/cft/downloadNoticeForAdvSearch.do?resourceId=4546142,,1500000.0,1
1147,Storage Solutions for Museum Collections,https://www.etenders.gov.ie/epps/cft/prepareViewCfTWS.do?resourceId=4547802,4547802,National Museum of Ireland,,Thu Oct 24 08:20:32 IST 2024,Wed Nov 20 12:00:00 GMT 2024,Open,Established,https://www.etenders.gov.ie/epps/cft/downloadNoticeForAdvSearch.do?resourceId=4547802,,8000000.0,1
1148,"2024/010 Framework for the Provision , supply and support of Windows 2 in 1 Computer Devices for Enterprise Ireland",https://www.etenders.gov.ie/epps/cft/prepareViewCfTWS.do?resourceId=4536895,4536895,Enterprise Ireland,,Wed Oct 23 07:50:22 IST 2024,Mon Nov 18 12:00:00 GMT 2024,Open,Established,https://www.etenders.gov.ie/epps/cft/downloadNoticeForAdvSearch.do?resourceId=4536895,,800000.0,1
1149,Request for Tender for an Electrical Contractor Multi Supplier Framework for Shannon Airport Authority DAC,https://www.etenders.gov.ie/epps/cft/prepareViewCfTWS.do?resourceId=4546181,4546181,Shannon Airport Authority DAC,,Tue Oct 22 16:09:42 IST 2024,Thu Nov 21 12:00:00 GMT 2024,Open,Established,https://www.etenders.gov.ie/epps/cft/downloadNoticeForAdvSearch.do?resourceId=4546181,,,1
1150,Establishment of a Multi Party Framework Agreement for Bridge Maintenance and Refurbishment Works for Kildare County Council,https://www.etenders.gov.ie/epps/cft/prepareViewCfTWS.do?resourceId=4513335,4513335,Kildare County Council_385,,Tue Oct 22 09:18:18 IST 2024,Tue Nov 19 16:00:00 GMT 2024,Open,Established,https://www.etenders.gov.ie/epps/cft/downloadNoticeForAdvSearch.do?resourceId=4513335,,1500000.0,1
1151,"Multi Supplier Framework Agreement for the provision of Property, Valuation and Associated services to Clare County Council",https://www.etenders.gov.ie/epps/cft/prepareViewCfTWS.do?resourceId=4531482,4531482,Clare County Council,,Tue Oct 22 07:51:17 IST 2024,Wed Nov 27 12:00:00 GMT 2024,Open,Established,https://www.etenders.gov.ie/epps/cft/downloadNoticeForAdvSearch.do?resourceId=4531482,,1000000.0,1
1152,Tender for the supply of merchandised goods to the Ombudsman for Children's Office,https://www.etenders.gov.ie/epps/cft/prepareViewCfTWS.do?resourceId=4539837,4539837,Ombudsman for Children's Office,,Mon Oct 21 20:10:25 IST 2024,Fri Dec 06 14:00:00 GMT 2024,Open,Established,https://www.etenders.gov.ie/epps/cft/downloadNoticeForAdvSearch.do?resourceId=4539837,,180000.0,1
1153,Meath Co Co - MH-ENV-24-04 - Supply of Water Refill stations to Meath County Council,https://www.etenders.gov.ie/epps/cft/prepareViewCfTWS.do?resourceId=4534282,4534282,Meath County Council,,Mon Oct 21 13:07:51 IST 2024,Tue Nov 12 12:00:00 GMT 2024,Open,Established,https://www.etenders.gov.ie/epps/cft/downloadNoticeForAdvSearch.do?resourceId=4534282,,150000.0,1
1154,The Supply and Delivery of Hair and Beauty Training Supplies and Equipment for Longford and Westmeath Education and Training Board (LWETB),https://www.etenders.gov.ie/epps/cft/prepareViewCfTWS.do?resourceId=4519109,4519109,Longford and Westmeath Education and Training Board,,Mon Oct 21 11:41:14 IST 2024,Tue Nov 19 12:00:00 GMT 2024,Open,Established,https://www.etenders.gov.ie/epps/cft/downloadNoticeForAdvSearch.do?resourceId=4519109,,800000.0,1
1155,"THE PROVISION OF SOFTWARE LICENCES, SUBSCRIPTION AND RENEWALS OF SOFTWARE TO HORSE RACING IRELAND AND SUBSIDIARIES AND THE IRISH HORSERACING REGULATORY BOARD",https://www.etenders.gov.ie/epps/cft/prepareViewCfTWS.do?resourceId=4518308,4518308,Horse Racing Ireland (HRI),,Mon Oct 21 11:40:47 IST 2024,Fri Nov 22 12:00:00 GMT 2024,Open,Established,https://www.etenders.gov.ie/epps/cft/downloadNoticeForAdvSearch.do?resourceId=4518308,,,1
1156,Multi Party Framework Agreement for Landscape Architect Consultancy Services for Residential Community Public Realm and Parks Projects in Dublin City Council,https://www.etenders.gov.ie/epps/cft/prepareViewCfTWS.do?resourceId=4480038,4480038,Dublin City Council,,Mon Oct 21 11:33:32 IST 2024,Mon Nov 25 17:00:00 GMT 2024,Open,Established,https://www.etenders.gov.ie/epps/cft/downloadNoticeForAdvSearch.do?resourceId=4480038,,250000.0,1
1157,Single Supplier Framework for the provision of Contract Cleaning Services to Munster Technological University Kerry Campus,https://www.etenders.gov.ie/epps/cft/prepareViewCfTWS.do?resourceId=4510056,4510056,Munster Technological University.,,Fri Oct 18 09:21:41 IST 2024,Mon Nov 25 12:00:00 GMT 2024,Open,Established,https://www.etenders.gov.ie/epps/cft/downloadNoticeForAdvSearch.do?resourceId=4510056,,,1
1158,"UCDOPP5312 Civil Engineering and Utility Works up to €1,500,000",https://www.etenders.gov.ie/epps/cft/prepareViewCfTWS.do?resourceId=4448760,4448760,University College Dublin ( UCD ),,Thu Oct 17 08:11:48 IST 2024,Wed Jan 08 12:00:00 GMT 2025,Open,Established,https://www.etenders.gov.ie/epps/cft/downloadNoticeForAdvSearch.do?resourceId=4448760,,1.2E7,1
1159,Provision of Consultancy Services to NMI to Produce a Strategy and Implementation Plan and Associated Documents for the National Museum of Ireland,https://www.etenders.gov.ie/epps/cft/prepareViewCfTWS.do?resourceId=4493413,4493413,National Museum of Ireland,,Wed Oct 16 08:11:40 IST 2024,Thu Nov 14 12:00:00 GMT 2024,Open,Established,https://www.etenders.gov.ie/epps/cft/downloadNoticeForAdvSearch.do?resourceId=4493413,,200000.0,1
1160,24-013 - Provision of Jetting and Tank Cleaning Management and Services to Uisce Éireann,https://www.etenders.gov.ie/epps/dps/prepareViewCfTDPSWS.do?resourceId=4492071,4492071,Uisce Éireann,,Wed Oct 16 08:10:39 IST 2024,,Qualification System,Established,https://www.etenders.gov.ie/epps/cft/downloadNoticeForAdvSearch.do?resourceId=4492071,,,1
1161,8705 Qualification System for CIÉ Foreign Exchange Services,https://www.etenders.gov.ie/epps/dps/prepareViewCfTDPSWS.do?resourceId=4498315,4498315,Coras Iompair Eireann (CIE Utility),,Tue Oct 15 12:25:48 IST 2024,,Qualification System,Established,,,,1
